{
  "$schema": "../../schemas/slot-vocabulary.schema.json",
  "locale": "en-US",
  "lastUpdated": "2026-05-31",

  "aliases": {
    "N": "round.finalCount",
    "Buddy_name": "kid.buddyName",
    "creature": "round.creatureSpecies",
    "creature_plural": "round.creatureSpeciesPlural",
    "startN": "round.startN",
    "changeN": "round.changeN",
    "resultN": "round.resultN",
    "A": "round.partA",
    "B": "round.partB",
    "total": "round.total",
    "actual": "round.kidCount",
    "missing": "round.delta",
    "extra": "round.delta",
    "target": "round.target",
    "shape_plural": "round.targetShapePlural",
    "attribute": "round.attributeName",
    "attribute1": "round.attribute1",
    "attribute2": "round.attribute2",
    "position_word": "round.positionWord",
    "landmark": "round.referenceLandmark",
    "landmark1": "round.landmark1",
    "landmark2": "round.landmark2",
    "actual_position": "round.kidDropZone",
    "target_position": "round.positionWord",
    "frame_shape": "round.frameShape",
    "piece": "round.nextPieceType",
    "position": "round.nextSlotName",
    "creature_name": "round.creatureName",
    "rule": "round.sortRule",
    "item": "round.nextItemName",
    "category": "round.nextCategoryName",
    "biggest_count": "round.biggestCount",
    "biggest_category": "round.biggestCategoryName",
    "next_count": "round.middleCount",
    "next_category": "round.middleCategoryName",
    "least_count": "round.leastCount",
    "least_category": "round.leastCategoryName",
    "object": "round.objectName",
    "object_plural": "round.objectNamePlural",
    "objectA": "round.objectAName",
    "objectB": "round.objectBName",
    "actual_heavier": "round.heavierObjectName",
    "actual_longer": "round.longerObjectName",
    "treat_A": "round.basketAContent",
    "treat_B": "round.basketBContent",
    "treat_A_plural": "round.basketAContentPlural",
    "treat_B_plural": "round.basketBContentPlural",
    "countA": "round.basketACount",
    "countB": "round.basketBCount",
    "comparison": "round.comparisonWord",
    "leftN": "round.leftNumeral",
    "rightN": "round.rightNumeral",
    "larger_basket": "round.largerBasketLabel",
    "least_basket": "round.leastBasketLabel",
    "most_basket": "round.mostBasketLabel",
    "numeral_name": "round.numeralName",
    "expected": "round.expectedNumeralName",
    "recognized": "round.recognizedNumeralName",
    "first_stroke_label": "round.firstStrokeLabel",
    "fact": "round.factDisplay",
    "result": "round.expectedAnswer",
    "maxCombo": "round.maxCombo",
    "groups": "round.clusterCount",
    "n": "round.extrasNeeded",
    "delta": "round.delta",
    "start": "round.startingAmount",
    "tagWord": "round.tagWord",
    "leave_verb": "round.leaveVerb",
    "remainder": "round.partB",
    "final": "round.finalN"
  },

  "vocabularies": {

    "kid.buddyName": {
      "type": "string",
      "description": "Kid-entered name for their Math Buddy.",
      "valueSet": "user-supplied",
      "ttsExpansionStrategy": "runtime-only"
    },
    "kid.avatarName": {
      "type": "string",
      "description": "Kid-entered name for their Avatar.",
      "valueSet": "user-supplied",
      "ttsExpansionStrategy": "runtime-only"
    },
    "kid.homeName": {
      "type": "string",
      "description": "Kid-chosen name for their Hub home.",
      "valueSet": "user-supplied",
      "ttsExpansionStrategy": "runtime-only"
    },

    "round.creatureSpecies": {
      "type": "enum",
      "description": "Singular species for the round's creature population.",
      "values": ["fawn", "duck", "frog", "dragonling", "baby-gryphon", "unicorn", "koi", "goat", "hatchling-dragon"],
      "ttsExpansionStrategy": "expand-per-value"
    },
    "round.creatureSpeciesPlural": {
      "type": "enum",
      "description": "Plural form of round.creatureSpecies.",
      "derivedFrom": "round.creatureSpecies",
      "values": {
        "fawn": "fawns",
        "duck": "ducks",
        "frog": "frogs",
        "dragonling": "dragonlings",
        "baby-gryphon": "baby gryphons",
        "unicorn": "unicorns",
        "koi": "koi",
        "goat": "goats",
        "hatchling-dragon": "hatchling dragons"
      },
      "ttsExpansionStrategy": "expand-per-value"
    },
    "round.targetCount": {
      "type": "integer",
      "description": "Target count for the round.",
      "range": { "min": 1, "max": 100 },
      "spokenAs": "numeral-as-word",
      "ttsExpansionStrategy": "digit-stitched"
    },
    "round.finalCount": {
      "type": "integer",
      "description": "The kid's final count at round end.",
      "range": { "min": 0, "max": 100 },
      "spokenAs": "numeral-as-word",
      "ttsExpansionStrategy": "digit-stitched"
    },
    "round.startN": {
      "type": "integer",
      "description": "Starting count (count-forward-from-N).",
      "range": { "min": 0, "max": 20 },
      "spokenAs": "numeral-as-word",
      "ttsExpansionStrategy": "digit-stitched"
    },
    "round.kidCount": {
      "type": "integer",
      "description": "The count the kid actually achieved (for failure narration).",
      "range": { "min": 0, "max": 20 },
      "spokenAs": "numeral-as-word",
      "ttsExpansionStrategy": "digit-stitched"
    },
    "round.delta": {
      "type": "integer",
      "description": "Difference between target and kid count.",
      "range": { "min": 1, "max": 10 },
      "spokenAs": "numeral-as-word",
      "ttsExpansionStrategy": "digit-stitched"
    },
    "round.clusterCount": {
      "type": "integer",
      "description": "Number of clusters in tens-parade.",
      "range": { "min": 2, "max": 10 },
      "spokenAs": "numeral-as-word",
      "ttsExpansionStrategy": "digit-stitched"
    },

    "round.startingAmount": {
      "type": "integer",
      "description": "Pre-placed count in make-ten and similar sub-modes.",
      "range": { "min": 0, "max": 10 },
      "spokenAs": "numeral-as-word",
      "ttsExpansionStrategy": "digit-stitched"
    },
    "round.target": {
      "type": "integer",
      "description": "Target amount the kid is building toward.",
      "range": { "min": 1, "max": 30 },
      "spokenAs": "numeral-as-word",
      "ttsExpansionStrategy": "digit-stitched"
    },
    "round.extrasNeeded": {
      "type": "integer",
      "description": "Additional units needed (ten-plus-n).",
      "range": { "min": 1, "max": 19 },
      "spokenAs": "numeral-as-word",
      "ttsExpansionStrategy": "digit-stitched"
    },
    "round.partA": {
      "type": "integer",
      "description": "First addend / first decomposition part.",
      "range": { "min": 0, "max": 10 },
      "spokenAs": "numeral-as-word",
      "ttsExpansionStrategy": "digit-stitched"
    },
    "round.partB": {
      "type": "integer",
      "description": "Second addend / second decomposition part.",
      "range": { "min": 0, "max": 10 },
      "spokenAs": "numeral-as-word",
      "ttsExpansionStrategy": "digit-stitched"
    },
    "round.resultN": {
      "type": "integer",
      "description": "Result of the operation (sum/difference).",
      "range": { "min": 0, "max": 10 },
      "spokenAs": "numeral-as-word",
      "ttsExpansionStrategy": "digit-stitched"
    },
    "round.changeN": {
      "type": "integer",
      "description": "Change amount in add-to / take-from stories.",
      "range": { "min": 1, "max": 10 },
      "spokenAs": "numeral-as-word",
      "ttsExpansionStrategy": "digit-stitched"
    },
    "round.total": {
      "type": "integer",
      "description": "Total in put-together / take-apart stories.",
      "range": { "min": 0, "max": 20 },
      "spokenAs": "numeral-as-word",
      "ttsExpansionStrategy": "digit-stitched"
    },
    "round.finalN": {
      "type": "integer",
      "description": "Final result in two-step stories.",
      "range": { "min": 0, "max": 20 },
      "spokenAs": "numeral-as-word",
      "ttsExpansionStrategy": "digit-stitched"
    },
    "round.leaveVerb": {
      "type": "enum",
      "description": "Verb describing how creatures leave the pond (take-from sub-mode).",
      "values": ["swim away", "fly off", "splash out", "hop away"],
      "ttsExpansionStrategy": "expand-per-value"
    },

    "round.targetShape": {
      "type": "enum",
      "description": "Singular target shape (K.G.2 find-shape).",
      "values": ["triangle", "circle", "square", "rectangle", "pentagon", "hexagon", "star"],
      "ttsExpansionStrategy": "expand-per-value"
    },
    "round.targetShapePlural": {
      "type": "enum",
      "description": "Plural form.",
      "derivedFrom": "round.targetShape",
      "values": {
        "triangle": "triangles",
        "circle": "circles",
        "square": "squares",
        "rectangle": "rectangles",
        "pentagon": "pentagons",
        "hexagon": "hexagons",
        "star": "stars"
      },
      "ttsExpansionStrategy": "expand-per-value"
    },
    "round.foundCount": {
      "type": "integer",
      "description": "Number of target shapes the kid found.",
      "range": { "min": 1, "max": 10 },
      "spokenAs": "numeral-as-word",
      "ttsExpansionStrategy": "digit-stitched"
    },
    "round.attributeName": {
      "type": "enum",
      "description": "Which attribute is being sorted by (K.G.4 sort-by-attribute).",
      "values": ["number of sides", "curvy or straight", "color paired with shape"],
      "ttsExpansionStrategy": "expand-per-value"
    },
    "round.attribute1": {
      "type": "enum",
      "description": "First attribute in two-attribute hunt.",
      "values": ["4-sided", "3-sided", "5-sided", "curvy", "straight", "red", "blue", "yellow", "large", "small"],
      "ttsExpansionStrategy": "expand-per-value"
    },
    "round.attribute2": {
      "type": "enum",
      "description": "Second attribute in two-attribute hunt.",
      "values": ["4-sided", "3-sided", "5-sided", "curvy", "straight", "red", "blue", "yellow", "large", "small"],
      "ttsExpansionStrategy": "expand-per-value"